<?xml version="1.0" encoding="utf-8"?>
<DanhSachDienThoai xmlns:xsi="http://www.w3.org/2001/XMLSchema-instance" xsi:noNamespaceSchemaLocation="DienThoai.xsd">
  <DienThoai>
    <MaSP>IPH-16PM-100-256-DES</MaSP>
    <TenSP>iPhone 16 Pro Max 256GB - Titan Sa Mạc (Chính Hãng VN/A)</TenSP>
    <MaHang>APPLE</MaHang>
    <TenHang>Apple</TenHang>
    <GiaBan>34990000</GiaBan>
    <SoLuongTon>25</SoLuongTon>
    <ThongSoKyThuat>
      <ManHinh>6.9" Super Retina XDR OLED ProMotion 120Hz 2000 nits Ceramic Shield thế hệ mới</ManHinh>
      <RAM>8GB</RAM>
      <BoNhoTrong>256GB</BoNhoTrong>
      <Pin>4685 mAh</Pin>
      <Chip>Apple A18 Pro (3nm thế hệ 2, 6-core GPU, Neural Engine 16-core)</Chip>
    </ThongSoKyThuat>
    <HinhAnh>/images/products/IPH-16PM-100-256-DES.png</HinhAnh>
    <MoTa>Flagship đỉnh cao nhất của Apple với màn hình viền siêu mỏng 6.9 inch, chip A18 Pro 3nm vượt trội, nút Điều khiển Camera độc quyền và thời lượng pin kỷ lục.</MoTa>
  </DienThoai>
  <DienThoai>
    <MaSP>IPH-16PM-100-512-NAT</MaSP>
    <TenSP>iPhone 16 Pro Max 512GB - Titan Tự Nhiên (Chính Hãng VN/A)</TenSP>
    <MaHang>APPLE</MaHang>
    <TenHang>Apple</TenHang>
    <GiaBan>40490000</GiaBan>
    <SoLuongTon>14</SoLuongTon>
    <ThongSoKyThuat>
      <ManHinh>6.9" Super Retina XDR OLED ProMotion 120Hz 2000 nits Ceramic Shield</ManHinh>
      <RAM>8GB</RAM>
      <BoNhoTrong>512GB</BoNhoTrong>
      <Pin>4685 mAh</Pin>
      <Chip>Apple A18 Pro (3nm)</Chip>
    </ThongSoKyThuat>
    <HinhAnh>/images/products/IPH-16PM-100-512-NAT.png</HinhAnh>
    <MoTa>Phiên bản dung lượng lớn 512GB sắc màu Titan Tự Nhiên sang trọng, hỗ trợ quay video 4K 120fps Dolby Vision và tính năng Apple Intelligence thông minh.</MoTa>
  </DienThoai>
  <DienThoai>
    <MaSP>IPH-16P-100-128-BLK</MaSP>
    <TenSP>iPhone 16 Pro 128GB - Titan Đen (Chính Hãng VN/A)</TenSP>
    <MaHang>APPLE</MaHang>
    <TenHang>Apple</TenHang>
    <GiaBan>28490000</GiaBan>
    <SoLuongTon>18</SoLuongTon>
    <ThongSoKyThuat>
      <ManHinh>6.3" Super Retina XDR OLED ProMotion 120Hz 2000 nits</ManHinh>
      <RAM>8GB</RAM>
      <BoNhoTrong>128GB</BoNhoTrong>
      <Pin>3582 mAh</Pin>
      <Chip>Apple A18 Pro (3nm)</Chip>
    </ThongSoKyThuat>
    <HinhAnh>/images/products/IPH-16P-100-128-BLK.png</HinhAnh>
    <MoTa>Màn hình mở rộng lên 6.3 inch với camera zoom quang học 5x chuyên nghiệp, kích thước nhỏ gọn dễ cầm nắm.</MoTa>
  </DienThoai>
  <DienThoai>
    <MaSP>IPH-16P-100-256-WHT</MaSP>
    <TenSP>iPhone 16 Pro 256GB - Titan Trắng (Chính Hãng VN/A)</TenSP>
    <MaHang>APPLE</MaHang>
    <TenHang>Apple</TenHang>
    <GiaBan>31490000</GiaBan>
    <SoLuongTon>16</SoLuongTon>
    <ThongSoKyThuat>
      <ManHinh>6.3" Super Retina XDR OLED ProMotion 120Hz 2000 nits</ManHinh>
      <RAM>8GB</RAM>
      <BoNhoTrong>256GB</BoNhoTrong>
      <Pin>3582 mAh</Pin>
      <Chip>Apple A18 Pro (3nm)</Chip>
    </ThongSoKyThuat>
    <HinhAnh>/images/products/IPH-16P-100-256-WHT.png</HinhAnh>
    <MoTa>Phiên bản Titan Trắng tinh khôi, cấu hình 256GB đáp ứng trọn vẹn nhu cầu lưu trữ video ProRAW và ứng dụng AI.</MoTa>
  </DienThoai>
  <DienThoai>
    <MaSP>IPH-16PLUS-100-128-BLU</MaSP>
    <TenSP>iPhone 16 Plus 128GB - Xanh Lưu Ly (Chính Hãng VN/A)</TenSP>
    <MaHang>APPLE</MaHang>
    <TenHang>Apple</TenHang>
    <GiaBan>25490000</GiaBan>
    <SoLuongTon>12</SoLuongTon>
    <ThongSoKyThuat>
      <ManHinh>6.7" Super Retina XDR OLED 2000 nits Ceramic Shield</ManHinh>
      <RAM>8GB</RAM>
      <BoNhoTrong>128GB</BoNhoTrong>
      <Pin>4674 mAh</Pin>
      <Chip>Apple A18 (3nm thế hệ 2)</Chip>
    </ThongSoKyThuat>
    <HinhAnh>/images/products/IPH-16PLUS-100-128-BLU.png</HinhAnh>
    <MoTa>Màn hình lớn 6.7 inch với thời lượng pin siêu bền, nút Action Button và nút Camera Control hoàn toàn mới.</MoTa>
  </DienThoai>
  <DienThoai>
    <MaSP>IPH-16-100-128-TEA</MaSP>
    <TenSP>iPhone 16 128GB - Xanh Mòng Két Teal (Chính Hãng VN/A)</TenSP>
    <MaHang>APPLE</MaHang>
    <TenHang>Apple</TenHang>
    <GiaBan>21990000</GiaBan>
    <SoLuongTon>20</SoLuongTon>
    <ThongSoKyThuat>
      <ManHinh>6.1" Super Retina XDR OLED 2000 nits Ceramic Shield</ManHinh>
      <RAM>8GB</RAM>
      <BoNhoTrong>128GB</BoNhoTrong>
      <Pin>3561 mAh</Pin>
      <Chip>Apple A18 (3nm)</Chip>
    </ThongSoKyThuat>
    <HinhAnh>/images/products/IPH-16-100-128-TEA.png</HinhAnh>
    <MoTa>Màu sắc xanh mòng két tươi trẻ độc đáo, cụm camera xếp dọc hỗ trợ quay Video Không Gian (Spatial Video).</MoTa>
  </DienThoai>
  <DienThoai>
    <MaSP>IPH-16-100-256-PNK</MaSP>
    <TenSP>iPhone 16 256GB - Hồng Pastel (Chính Hãng VN/A)</TenSP>
    <MaHang>APPLE</MaHang>
    <TenHang>Apple</TenHang>
    <GiaBan>24490000</GiaBan>
    <SoLuongTon>15</SoLuongTon>
    <ThongSoKyThuat>
      <ManHinh>6.1" Super Retina XDR OLED 2000 nits</ManHinh>
      <RAM>8GB</RAM>
      <BoNhoTrong>256GB</BoNhoTrong>
      <Pin>3561 mAh</Pin>
      <Chip>Apple A18 (3nm)</Chip>
    </ThongSoKyThuat>
    <HinhAnh>/images/products/IPH-16-100-256-PNK.png</HinhAnh>
    <MoTa>Phiên bản màu hồng quyến rũ, dung lượng 256GB thoải mái quay chụp và cài đặt ứng dụng.</MoTa>
  </DienThoai>
  <DienThoai>
    <MaSP>IPH-15PM-100-256-NAT</MaSP>
    <TenSP>iPhone 15 Pro Max 256GB - Titan Tự Nhiên (VN/A Mới 100%)</TenSP>
    <MaHang>APPLE</MaHang>
    <TenHang>Apple</TenHang>
    <GiaBan>28990000</GiaBan>
    <SoLuongTon>22</SoLuongTon>
    <ThongSoKyThuat>
      <ManHinh>6.7" LTPO Super Retina XDR OLED 120Hz ProMotion 2000 nits</ManHinh>
      <RAM>8GB</RAM>
      <BoNhoTrong>256GB</BoNhoTrong>
      <Pin>4422 mAh</Pin>
      <Chip>Apple A17 Pro (3nm)</Chip>
    </ThongSoKyThuat>
    <HinhAnh>/images/products/IPH-15PM-100-256-NAT.png</HinhAnh>
    <MoTa>Khung vỏ Titan cấp 5 nguyên khối siêu nhẹ, chip A17 Pro 3nm, nút Action Button và cổng kết nối USB-C.</MoTa>
  </DienThoai>
  <DienThoai>
    <MaSP>IPH-15P-99-128-BLU</MaSP>
    <TenSP>iPhone 15 Pro 128GB - Titan Xanh (Likenew 99%)</TenSP>
    <MaHang>APPLE</MaHang>
    <TenHang>Apple</TenHang>
    <GiaBan>20990000</GiaBan>
    <SoLuongTon>10</SoLuongTon>
    <ThongSoKyThuat>
      <ManHinh>6.1" OLED 120Hz ProMotion Super Retina XDR</ManHinh>
      <RAM>8GB</RAM>
      <BoNhoTrong>128GB</BoNhoTrong>
      <Pin>3274 mAh</Pin>
      <Chip>Apple A17 Pro (3nm)</Chip>
    </ThongSoKyThuat>
    <HinhAnh>/images/products/IPH-15P-99-128-BLU.png</HinhAnh>
    <MoTa>Khung viền titan xanh sang trọng, máy nguyên bản zin áp suất, hiệu năng mượt mà mọi tác vụ.</MoTa>
  </DienThoai>
  <DienThoai>
    <MaSP>IPH-15-100-128-BLK</MaSP>
    <TenSP>iPhone 15 128GB - Đen (Chính Hãng VN/A)</TenSP>
    <MaHang>APPLE</MaHang>
    <TenHang>Apple</TenHang>
    <GiaBan>18490000</GiaBan>
    <SoLuongTon>15</SoLuongTon>
    <ThongSoKyThuat>
      <ManHinh>6.1" Super Retina XDR OLED 2000 nits</ManHinh>
      <RAM>6GB</RAM>
      <BoNhoTrong>128GB</BoNhoTrong>
      <Pin>3349 mAh</Pin>
      <Chip>Apple A16 Bionic (4nm)</Chip>
    </ThongSoKyThuat>
    <HinhAnh>/images/products/IPH-15-100-128-BLK.png</HinhAnh>
    <MoTa>Thiết kế Dynamic Island thông minh, mặt lưng kính pha màu mờ sang trọng và camera chính 48MP.</MoTa>
  </DienThoai>
  <DienThoai>
    <MaSP>IPH-15-100-256-PNK</MaSP>
    <TenSP>iPhone 15 256GB - Hồng (Chính Hãng VN/A)</TenSP>
    <MaHang>APPLE</MaHang>
    <TenHang>Apple</TenHang>
    <GiaBan>20490000</GiaBan>
    <SoLuongTon>12</SoLuongTon>
    <ThongSoKyThuat>
      <ManHinh>6.1" Super Retina XDR OLED 2000 nits</ManHinh>
      <RAM>6GB</RAM>
      <BoNhoTrong>256GB</BoNhoTrong>
      <Pin>3349 mAh</Pin>
      <Chip>Apple A16 Bionic (4nm)</Chip>
    </ThongSoKyThuat>
    <HinhAnh>/images/products/IPH-15-100-256-PNK.png</HinhAnh>
    <MoTa>Màu hồng pastel nữ tính, dung lượng 256GB nhân đôi không gian lưu trữ ảnh và video.</MoTa>
  </DienThoai>
  <DienThoai>
    <MaSP>IPH-15-100-128-GRN</MaSP>
    <TenSP>iPhone 15 128GB - Xanh Lá (Chính Hãng VN/A)</TenSP>
    <MaHang>APPLE</MaHang>
    <TenHang>Apple</TenHang>
    <GiaBan>18490000</GiaBan>
    <SoLuongTon>8</SoLuongTon>
    <ThongSoKyThuat>
      <ManHinh>6.1" Super Retina XDR OLED 2000 nits</ManHinh>
      <RAM>6GB</RAM>
      <BoNhoTrong>128GB</BoNhoTrong>
      <Pin>3349 mAh</Pin>
      <Chip>Apple A16 Bionic</Chip>
    </ThongSoKyThuat>
    <HinhAnh>/images/products/IPH-15-100-128-GRN.png</HinhAnh>
    <MoTa>Màu xanh bạc hà thanh lịch dịu mắt, hiệu năng A16 Bionic tối ưu mượt mà cho mọi tác vụ.</MoTa>
  </DienThoai>
  <DienThoai>
    <MaSP>IPH-15-100-128-YEL</MaSP>
    <TenSP>iPhone 15 128GB - Vàng Nhạt (Chính Hãng VN/A)</TenSP>
    <MaHang>APPLE</MaHang>
    <TenHang>Apple</TenHang>
    <GiaBan>18490000</GiaBan>
    <SoLuongTon>7</SoLuongTon>
    <ThongSoKyThuat>
      <ManHinh>6.1" Super Retina XDR OLED 2000 nits</ManHinh>
      <RAM>6GB</RAM>
      <BoNhoTrong>128GB</BoNhoTrong>
      <Pin>3349 mAh</Pin>
      <Chip>Apple A16 Bionic</Chip>
    </ThongSoKyThuat>
    <HinhAnh>/images/products/IPH-15-100-128-YEL.png</HinhAnh>
    <MoTa>Sắc vàng ánh dương ấm áp tươi sáng, mặt kính sau hoàn thiện nhám mờ hạn chế bám vân tay.</MoTa>
  </DienThoai>
  <DienThoai>
    <MaSP>SS-S24U-100-256-GRY</MaSP>
    <TenSP>Samsung Galaxy S24 Ultra 5G 256GB - Xám Titan (Galaxy AI)</TenSP>
    <MaHang>SAMSUNG</MaHang>
    <TenHang>Samsung</TenHang>
    <GiaBan>26990000</GiaBan>
    <SoLuongTon>25</SoLuongTon>
    <ThongSoKyThuat>
      <ManHinh>6.8" Flat Dynamic AMOLED 2X 120Hz 2600 nits Corning Gorilla Armor chống chói</ManHinh>
      <RAM>12GB</RAM>
      <BoNhoTrong>256GB</BoNhoTrong>
      <Pin>5000 mAh</Pin>
      <Chip>Snapdragon 8 Gen 3 for Galaxy (4nm)</Chip>
    </ThongSoKyThuat>
    <HinhAnh>/images/products/SS-S24U-100-256-GRY.png</HinhAnh>
    <MoTa>Vua Android Flagship với quyền năng trí tuệ nhân tạo Galaxy AI, bút S-Pen tích hợp, khung Titan siêu cứng và màn hình phẳng chống phản chiếu tốt nhất thế giới.</MoTa>
  </DienThoai>
  <DienThoai>
    <MaSP>SS-S24P-100-256-BLK</MaSP>
    <TenSP>Samsung Galaxy S24+ 5G 256GB - Đen Onyx (Galaxy AI)</TenSP>
    <MaHang>SAMSUNG</MaHang>